job_id,job_title,platform,description
1,"Data Entry - Work from Home","Freelancer.in","Simple data entry job. Pay Rs 500 registration fee via UPI to start today. WhatsApp 9876543210"
2,"Part Time Typing","Upwork","Earn 50k/month typing. Telegram interview now. Pay Rs 999 processing fee first."
3,"Customer Support","Naukri.com","Genuine WFH support role. Apply via official Naukri process."
4,"Form Filling","LinkedIn","Easy form filling. Rs 200 deposit on Google Pay to activate account immediately."
5,"Data Entry Operator","Indeed","Same client as job #1. Pay Rs 500 via PhonePe. Urgent start today."
6,"Python Developer","MonsterIndia","Full stack Python role. Apply through official careers page."
